Identifier,Label,Description,Created,Modified,History notes,Type,
534,Recycling sites,"Provision of collection sites (also known as bottle or recycling banks and 'bring sites'), for recyclable waste which are easily accessible by local residents (often near supermarkets, in car parks etc.).  Sites usually have facilities to collect glass and paper with some also providing facilities for textiles, plastics and cans.",2013-04-03,2013-04-03,Added scope notes in version 2.02.  Scope notes updated in version 3.01 for clarification. Term name changed from 'Recycling - collection sites' to 'Recycling - sites' in version 3.02.  Name changed to 'recycling sites' in version 4.00.,Service,
724,Referenda,Information on the different referenda which can take place and legal terms under which they may be carried out.,2013-04-03,2013-04-03,Added scope notes in version 2.02. Scope notes changed in version 3.00 to include relevant legislation. Name changed to 'referenda' in version 4.00.,Service,
836,Referral orders,Referral orders are given to aged 10 to 17 year olds pleading guilty and being convicted for the first time in court.,2013-04-03,2013-04-03,Added scope notes in version 2.02. Term name changed from 'Referral orders' to 'Youth justice - referral orders' in version 3.00.,Service,
1472,Refuse duty of care - enforcement,"Anyone who produces or imports, keeps or stores, transports, treats or disposes of waste has a duty of care to complete any necessary paperwork and to deal with the waste in the appropriate manner. The council may take action against anyone who has not complied with the regulations",2013-04-03,2013-04-03,Added in version 3.11.,Service,
823,Regeneration projects,"The purpose of regeneration is to improve the social, economic, physical and environmental wellbeing of our local communities. Regeneration programmes are groups of projects, which work together to make this happen. Examples of these might be a programme to help new businesses get started across the council area or programme to reduce crime in particular communities.",2013-04-03,2013-04-03,Added scope notes in version 2.02. . Scope notes updated in version 3.06 to include Socttish terminology. Term name changed from 'Regeneration projects' to 'Community development - regeneration projects' in version 3.00. name changed to 'Regeneration projects' in version 4.00.,Service,
1038,Registering business premises,Business premises are required to be registered with the local authority. Following an application an Officer will visit premises to check they meet health and safety guidelines and conform with local Byelaws. Premises will be inspected on a regular basis once registered.,2013-04-03,2013-04-03,Name changed to 'Registering business premises' in version 4.00.,Service,
92,Registering for a council property,The local authority processes applications to go on the housing register and allocates points to prospective tenants according to their current circumstances. The criteria under which an authority are likely to accept/reject applications to go on the register are published together with information on the application procedure.,2013-04-03,2013-04-03,Added scope notes in version 2.02. Term name changed from 'Housing allocations - registering for a council property' to 'Housing - allocations - registering for a council property' in version 3.00. Name changed to 'Registering for a council property' in version 4.00.,Service,
866,Registration - motor salvage operator,"Any person who carries on a business that involves the recovery of salvageable parts from motor vehicles and the subsequent sale or disposal for scrap of the remainder of the vehicle, or the purchase of 'written off' vehicles for repair or resale, or other related activities needs to register with their local authority. 
In Scotland the Road Safety Bill currently being considered by the Scottish Parliament may legislate in this area.",2013-04-03,2013-04-03,Term name changed from 'Licences - motor salvage operator' to 'Registration - motor salvage operator' in version 3.03.,Service,
1328,Regulation of dry cleaning premises,"Any dry cleaning installations using solvents are required to have a permit. Any installation being brought into operation for the first time must apply for, and be granted, a permit prior to starting operation.
In Scotland permits are issued by SEPA",2013-04-03,2013-04-03,Added in version 3.09. Name changed to 'regulation of dry cleaning premises' in version 4.00.,Service,
368,Release of CCTV evidence,"Publication of the procedure and conditions under which CCTV evidence may be released to third party organisations (police, statutory authorities etc.) or to members of the public.",2013-04-03,2013-04-03,Added scope notes in version 2.02. Term name changed from 'CCTV procedure for the release of evidence' to 'Law - CCTV - procedures for the release of evidence' in version 3.00. Name changed to 'Release of CCTV evidence' in version 4.00.,Service,
116,Rent arrears,The local authority deals with tenants who are in rent arrears by arranging mutual repayment of arrears by instalments. If the arrears continue to rise the local authority may take the tenant to court.,2013-04-03,2013-04-03,Added scope notes in version 2.02. Term name changed from 'Council housing - current tenancy arrears' to 'Housing - council - current tenancy arrears' in version 3.00. Name changed to 'Rent arrears' in version 4.00.,Service,
1055,Rent determination,"The local authority is obliged to send details of a tenancy to the Rent Office for private tenants in receipt of housing benefit whose tenancy commenced after 1 January 1989, the local authority is obliged to send details of your tenancy to the Rent Officer.  It is the responsibility of the Rent Officer to tell us if you are being charged a reasonable rent for your accommodation.  The Rent Officer will make a determination and advise us of the appropriate rent to be used in your Housing Benefit assessment.",2013-04-03,2013-04-03,Name changed to 'Rent determination' in version 4.00.,Service,
177,Reparation orders,"A Reparation Order is a sentence of the Court, which will be supervised by a member of the council Youth Offending Team. The aims of a Reparation Order are to prevent further offences by helping the offender to understand the effects of crime on the victim and to make amends.",2013-04-03,2013-04-03,Added scope notes in version 2.02. Term name changed from 'Reparation orders' to 'Youth justice - reparation orders' in version 3.00. Name changed to 'Reparation orders' in version 4.00.,Service,
327,Repatriation of bodies abroad,"Some countries require a Cadaver Certificate before they will allow a body into the country for burial. The certificate, if issued, confirms that no epidemic of infectious disease occurred in the location of death for some three months preceding the death. Every country has its own regulations and it is always worth checking with the Embassy or Consulate first.
In the UK the certificate is issued by the Environmental Health Officer for the Council in whose area the person died, or is to be exhumed from before reburial elsewhere.",2013-04-03,2013-04-03,Added scope notes in version 2.02. Scope notes updated in version 3.00. Term name changed from 'Repatriation of a deceased body abroad' to 'Death - repatriation of bodies - abroad' in version 3.00. Name changed to 'Repatriation of bodies abroad' in version 4.00.,Service,
781,Reservoir management,"Where reservoirs exist within the local authority area the council (often jointly with theother local or national authorities) is responsible for the maintenance of the reservoir and the surrounding land and the management of reservoir use for recreation. 
In Scotland, local authorities as the Enforcement Authority have duties to maintain a register of all large raised reservoirs, to enforce the measures stipulated in relevant legislation, and to report on them to the Scottish Ministers biennially. Primary responsibility for reservoir safety, however, lies with the undertakers.",2013-04-03,2013-04-03,Added scope notes in version 2.02. Scope notes updated in version 3.00 to clarify council responsibility. Term name changed from 'Reservoir management' to 'Reservoirs - management' in version 3.00. Scope notes amended in version 3.05. Name changed to 'Reservoir management' in version 4.00.,Service,
263,Residential care for children and young people,"Provision of residential accommodation for children and young people who cannot live with their natural families. Prior to a placement in residential accommodation there will be assessment of need undertaken in conjunction with the young person (and their family if appropriate), social workers and residential staff.",2013-04-03,2013-04-03,Added scope notes in version 2.02. Term name changed from 'Residential care for children' to 'Children and young people - residential care' in version 3.00. Name changed to 'Residential care for children and young people' in version 4.00.,Service,
485,Residential planning applications,"If a resident is thinking of making alterations to their house/flat they will need to consult the planning section to see if they require planning permission. Applicants will need planning permission if the applicant's property is a listed building, if the applicant is planning to alter or extend their home, if there is a change of use (working from home) and no longer a main home or if the applicant is interested in putting up a new home. 
In the UK, if planning permission is required, the resident must fill in the Standard Planning Application Form (1APP) and meet all of the Planning Application Requirements (PAR).",2013-04-03,2013-04-03,Added scope notes in version 2.02. Term name changed from 'Planning - residential' to 'Planning - private houses' in version 3.00. Term name changed from 'Planning - private houses' to 'Planning applications - residential' in version 3.02. Updated scope notes in version 3.03. name changed to 'Residential planning applications' in version 4.00.,Service,
1130,Residential recycling collections,The local authority provides a regular (usually weekly) collection of household items for recycling from residential premises within the authority boundaries.,2013-04-03,2013-04-03,name changed to 'Residential recycling collections' in version 4.00.,Service,
227,Respite care for adults,Carers and the people they are caring for may be entitled to respite care in the form of a temporary place in residential accommodation or provision of an alternative qualified carer to give both the  carer and their families a break.,2013-04-03,2013-04-03,Term name changed from 'Respite care' to 'Respite care for adults' and scope notes added in version 2.02. Term name changed from 'Respite care for adults' to 'Carers - adult - respite care' in version 3.00. Name changed to 'respite care for adults' in version 4.00.,Service,
260,Respite care for children and young people,"Respite care is a form of short-term substitute care provided by someone other than the parents or usual carers for a child. Respite care is a key support to families and is organised to suit the needs of the particular child and family. It can take place in a hospital, residential setting or in the child's own home.It gives parents free time to give them a rest, to spend time with their other children or in an emergency.",2013-04-03,2013-04-03,Added scope notes in version 2.02. Term name changed from 'Respite care for children' to 'Children and young people - respite care' in version 3.00. Name changed to 'respite care for children and young people' in version 4.00.,Service,
403,Retail trading standards,"This service aims to ensure that any retailer operating in the area is confident that they can do so in the knowledge that they are operating in a fair, safe and equitable trading environment.",2013-04-03,2013-04-03,Term name changed from 'Retail' to 'Retail- trading standards' and scope notes added in version 2.02. Term name changed from 'Retail- trading standards' to 'Trading standards - retail' in version 3.00. Name changed to 'Retail trading standards' in version 4.00.,Service,
1088,Re-use of public sector information,On 1 July 2005 a new European Directive came into force which allows people to apply to re-use information held by the Council. 'Re-use' means using the information for a purpose other than the purpose for which the document was originally produced. This could include a commercial purpose. The new directive does not provide access to the information itself.,2013-04-03,2013-04-03,Name changed to 'Re-use of public sector information' in version 4.00,Service,
696,Riding establishment licence,"Stables, which hire out horses or ponies for riding or instruction must be licensed . A report is also required from a veterinary Surgeon or Practitioner.",2013-04-03,2013-04-03,Added scope notes in version 2.02. Term name changed from 'Licence - riding establishment' to 'Licences - riding establishments' in version 3.00. Name changed to 'Riding establishment licence' in version 4.00.,Service,
151,Right to buy your home,The right to buy scheme allows a secure tenant who has held a local authority tenancy for two years to purchase their property at a discounted price.,2013-04-03,2013-04-03,Added scope notes in version 2.02. Term name changed from 'Home ownership service - right to buy' to 'Housing - council - right to buy' in version 3.00. Name changed to 'Right to buy your home' in version 4.00.,Service,
614,Rights of way enforcement,It is the responsibility of the local authority to ensure that public rights of way are kept clear of obstructions and that landowners meet their responsibilities in this respect.  The local authority should offer advice and where appropriate take action over blocked or disputed public rights of way.,2013-04-03,2013-04-03,Added scope notes in version 2.02. Term name changed from 'Public rights of way - enforcement' to 'Planning - rights of way - enforcement' in version 3.00. name changed to 'Rights of way enforcement' in version 4.00.,Service,
1120,Rights of way maintenance,"The local authority may be responsible (often in conjunction with other organisations such as SusTrans) for building, improving and maintaining public rights of way in their area.  These may be local rights of way or sections of national networks such as the 'National Cycling Network' or long-distance footpaths.",2013-04-03,2013-04-03,Name changed to 'Rights of way maintenance' in version 4.00.,Service,
701,Road adoption,"New roads that have been constructed in accordance with the council's guidelines are normally adopted by way of an agreement between the developer and the council. Local authorities are obliged to publish a register of road adoptions and road works, which is available for public inspection.",2013-04-03,2013-04-03,"Added scope notes in version 2.02, Scope notes updated in version 3.00 to clarify responsibilities and include maintaining the statutory register. Term name changed from 'Road adoption' to 'Roads - adoption agreements' in version 3.00. Name changed to 'Road adoption' in version 4.00.",Service,
553,Road bridges,The local authority is responsible for any highway bridges it owns. These bridges should be inspected regularly and a programme of maintenance work drawn up to ensure their safety.,2013-04-03,2013-04-03,Added scope notes in version 2.02. Term name changed from 'Roads and highways - bridges (general)' to 'Roads - bridges ' in version 3.00. Name changed to 'Road bridges' in version 4.00.,Service,
570,Road closures and diversions,"A traffic regulation order issued by the local authority where works on the highway, or some large deliveries, require a road to be closed temporarily to general traffic.",2013-04-03,2013-04-03,Added scope notes in version 2.02. Term name changed from 'Roads and highways - closures and diversions' to 'Roads - closures and diversions' in version 3.00. Name changed to 'Road closures and diversions' in version 4.00.,Service,
1587,Road congestion reduction,Where traffic congestion is a particular problem schemes may be introduced to limit the amount of traffic in a specified area.  Examples of congestion reduction schemes include   'park and ride' and congestion charging zones.,2013-04-03,2011-10-18,Added in version 3.14.,Service,
561,Road gritting,Gritting of primary and secondary roads within the local authority area when weather conditions may prove hazardous (i.e. freezing temperatures).  The local authority may also provide grit bins for public use on roads and pavements in potentially dangerous areas.,2013-04-03,2013-04-03,Added scope notes in version 2.02. Term name changed from 'Gritting' to 'Roads - gritting' in version 3.00. Name changed to 'Road gritting' in version 4.00.,Service,
557,Road maintenance,Maintenance and repair of potholes where the surface of the road has been eroded posing a risk to road users.,2013-04-03,2013-04-03,Term name changed from 'Potholes' to 'Road maintenance' and scope notes added in version 2.02. Term name changed from 'Road maintenance' to 'Roads - maintenance' in version 3.00. Name changed to 'Road maintenance' in version 4.00.,Service,
550,Road obstructions,Highways must be kept clear of obstructions for safety reasons. The local authority has the power to serve notice on a person who commits an offence of wilful obstruction on the highway. In certain circumstances the courts allow the highway authority to remove obstructions and recover reasonable costs incurred in doing so from the offender.,2013-04-03,2013-04-03,Added scope notes in version 2.02. Term name changed from 'Roads and highways - obstructions' to 'Roads - obstructions' in version 3.00. Name changed to 'Road obstructions' in version 4.00.,Service,
784,Road safety cameras,"Safety cameras are designed to detect and prevent speed limit offences and traffic signal violations, and provide evidence for a fixed penalty notice.",2013-04-03,2013-04-03,Added scope notes in version 2.02. Term name changed from 'Road safety - speed checks' to 'Roads - safety - speed checks' in version 3.00. Term name changed from 'Roads - safety - speed checks' to ' Roads - safety - cameras' and scope notes updated in version 3.02. Name changed to 'Road safety cameras' in version 4.00.,Service,
540,Road signs,"The local authority has responsibility for installing signs to regulate traffic and to provide warnings to drivers of hazards ahead. The signs that may be used on the public highway are controlled by government regulations, covering the designs of the signs, where they can be used and whether they must be illuminated.",2013-04-03,2013-04-03,Added scope notes in version 2.02. Term name changed from 'Road markings and signage - road signs' to 'Roads - markings and signage - road signs' in version 3.00. Name changed to 'Road signs' in version 4.00.,Service,
591,Road spillages,The local authority is responsible for keeping the highway clean and free from spillages.  Where spillages are of a hazardous nature the local police and fire service may also be involved in the incident and road closures may be required.,2013-04-03,2013-04-03,Added scope notes in version 2.02. Term name changed from 'Spillage - roads' to 'Roads - safety - spillages' in version 3.00. Name changed to 'Road spillages' in version 4.00.,Service,
549,Road surveys,"The council is responsible for carrying out repairs and for administering highway legislation. This includes planned and emergency maintenance, surveys and street works",2013-04-03,2013-04-03,Added scope notes in version 2.02. Term name changed from 'Roads and highways - maintenance programme structural surveys' to 'Roads - maintenance - structural surveys' in version 3.00. Name changed to 'Road surveys' in version 4.00.,Service,
569,Road works notification,"Notification of road closures, diversions and possible traffic disruption as a result of road works that are underway or programmed to take place within the area. Local authorities are obliged to publish a register of road adoptions and road works, which is available for public inspection.",2013-04-03,2013-04-03,Added scope notes in version 2.02. Term name changed from 'Roads and highways - works' to 'Roads - road-works' in version 3.00. Name changed to 'Road works notification' in version 4.00.,Service,
1586,Roads - child play areas,Certain roads may be designated as children's play areas.  Such roads may be closed to vehicles permanently or at certain times of day.  Where roads are not closed they may be subject to reduced speed limits and traffic may have to give priority to children and pedestrians.,2013-04-03,2011-10-18,Added in version 3.14.,Service,
542,Roads - markings and signage - quality bus corridors,"On certain main roads in yellow lines indicating a parking ban have been replaced by red lines (or alternative markings such as greenways etc.). Unlike yellow lines, alternative markings prohibit all stopping, parking and loading.  Red routes are designed to ensure the free flow of traffic and that bus routes are kept clear at all times.",2013-04-03,2013-04-03,Added scope notes in version 2.02. Term name changed from 'Road markings and signage - red routes' to 'Roads - markings and signage - red routes' in version 3.00.  Scope notes updated in version 3.01 to include alternative markings for Scotland. Name changed to 'Red routes' in version 4.00.,Service,
551,Roads enforcement,The Council has a duty to protect the public rights on the road and footpath network. The effectiveness of legislation in protecting the public is dependant on the compliance of others. The local highways authority has a duty to maintain adopted highways to safe and serviceable standards,2013-04-03,2013-04-03,Added scope notes in version 2.02. Term name changed from 'Roads and highways - enforcement' to 'Roads - enforcement' in version 3.00. Name changed to 'Roads enforcement' in version 4.00.,Service,
552,Roads weight limits,"The local authority can impose weight restrictions on public roads for structural or for environmental reasons. Such restrictions prevent large vehicles from using inappropriate roads, routes and areas.  It is the responsibility of the local authority to monitor and deal with abuse of any imposed weight restrictions.",2013-04-03,2013-04-03,Added scope notes in version 2.02. Term name changed from 'Roads and highways - weight limits' to 'Roads - weight limits' in version 3.00. Name changed to 'Road weight limits' in version 4.00.,Service,
731,Safeguarding vulnerable adults,"The adult protection procedure aims to provide a system that a range of organisations or individuals can use to report and respond to situations where it is suspected, alleged or known that a vulnerable adult has been abused",2013-04-03,2013-04-03,"Added scope notes in version 2.02. Term name changed from 'Protection of vulnerable adults' to 'Social services - vulnerable adults - protection' in version 3.00, and to 'Social services - safeguarding vulnerable adults' in version 3.06. Name changed to 'Safeguarding vulnerable adults' in version 4.00.",Service,
827,Sale of gifts and publications,"Goods and publications relevant to the local area for sale to the public. This may include such items as local maps, photographs, cards, locally made items, plants and flowers etc.  Items are often sold in local Tourist offices.",2013-04-03,2013-04-03,Added scope notes in version 2.02. scope notes updated in version 3.00 to include examples. Term name changed from 'Sale of sundry items and publications' to 'Council - commercial activities - sundry items and publications' in version 3.00. Name changed to 'Sale of goods and publications' and scope notes revised in version 4.00.,Service,
382,Scaffolding and hoarding licence,"""Any scaffold or hoarding which encroaches or projects over the highway requires a scaffold permit. These permits are only issued to the scaffolding company. 
In Scotland if you propose to occupy or open part of a road (i.e.. carriageway, footway, footpath or cycle path etc), there is a requirement to obtain permission from the local Roads Authority. This is done by applying for the relevant permit.""@en",2013-04-03,2013-04-03,Added scope notes in version 2.02. Scope notes changed in version 3.00 to include Scottish legislation. Term name changed from 'Licence - scaffolding and hoarding' to 'Licences - obstructions - scaffolding and hoarding' in version 3.00. Name changed to 'Scaffolding and hoarding licence' in version 4.00.,Service,
705,School admission appeals,A pupil may appeal for a place at any community school to which they apply and for which they have been refused a place. The responsibility for appeals rests with the local education authority.,2013-04-03,2013-04-03,Added scope notes in version 2.02. Term name changed from 'School admissions - appeals' to 'Schools - admissions - appeals' in version 3.00. Name changed to 'School admission appeals' in version 4.00.,Service,
31,School assessment  and performance,"Performance and assessment reports help schools look at their strength and weaknesses, compare their performance with other schools and develop plans to raise their standards.",2013-04-03,2013-04-03,Term name changed from 'Attainment/performance' to 'Attainment/performance - schools' and scope notes added in version 2.02. Term name changed from 'Attainment/performance - schools' to 'Schools - assessment and performance' in version 3.00.  Term name changed to 'School assessment and performance' in version 4.00.,Service,
