Identifier,Label,Description,Created,Modified,History notes,Type,
1614,16 to 19 bursary fund,"Those aged between 16 and 19 years who think they might struggle with the costs for full-time education or training, may be eligible for a bursary. ",2013-04-03,2013-04-03,Added in version 4.00.,Service,
1152,Abandoned shopping trolleys,"Abandoned shopping trolleys have a negative impact on the quality of the local environment and can be hazardous to pedestrians, cyclists and road users.  Local Authorities are permitted to seize, store and dispose of abandoned shopping trolleys within their area.",2013-04-03,2013-04-03,Added in version 3.05.,Service,
372,Abandoned vehicles,The local council will deal with any vehicles reported as abandoned on local roads or property (usually including private property). The vehicle will be removed.,2013-04-03,2013-04-03,"Added scope notes in version 2.02, updated in version 3.06. Term name changed from 'Abandoned vehicles' to 'Vehicles - abandoned - reporting and procedures' in version 3.00. Name changed to 'Abandoned vehicles' in version 4.00.",Service,
785,Abnormal load notification,A haulier who intend to move an abnormal load such as gross weight exceeding 40 tonnes or more must notify and gain consent from the police or the local authority..,2013-04-03,2013-04-03,Added scope notes in version 2.02. Term name changed from 'Abnormal loads' to 'Transport - abnormal loads - notification' in version 3.00. Name changed to 'Abnormal load notification' in version 4.00.,Service,
1466,Accessibility - local facilities,"Information on the accessibility of various facilities - shops, theatres, leisure centres etc. - within the local authority area. 
In the UK this information is often provided in conjunction with DisabledGo.",2013-04-03,2013-04-03,Added in version 3.10. Name changed to 'Accessibility - local facilities' in version 4.00.,Service,
853,Accessibility of Web sites,The local authority is expected to provide information via it's web site in a way which is accessible to all citizens and to advise citizens of the steps it has taken to meet the required government standards on accessibility,2013-04-03,2013-04-03,Added scope notes in version 2.02. Term name changed from 'Internet service standards' to 'Council websites - accessibility' in version 3.00. name changed to 'Accessibility of Web sites' in version 4.00.,Service,
429,Accident reporting,"Employers have a duty to report certain dangerous occurrences and accidents at work to the Local Authority who will investigate any incidents. The outcome of these enquiries usually involves the giving of advice to the employer. If a blatant breach of requirements is identified as the main reason for an accident happening, then formal action will be taken.",2013-04-03,2013-04-03,Added scope notes in version 2.02. Term name changed from 'Accidents' to 'Safety - health and safety - accident reporting' in version 3.00. Name changed to 'Accident reporting' in version 4.00.,Service,
681,Acupuncturist registration,All persons that carry out acupuncture are required to be registered with the local authority. Officers will visit the premises to ensure they comply with the requirements of all relevant legislation.,2013-04-03,2013-04-03,Added scope notes in version 2.02. Term name changed from 'Licence - acupuncturist' to 'Licences - acupuncturist' in version 3.00. Term name changed from 'Licences - acupuncturist' to 'Registration - acupuncturist' in version 3.03. Name changed to 'Acupuncturist registration' in version 4.00.,Service,
160,Adoption,The local authority attempts to find adoptive homes for children who are no longer able to live in their own homes.  The authority reviews applications from prospective adoptive parents to assess suitability.  Ongoing support is provided for adopted children and their new families.,2013-04-03,2013-04-03,Term name changed from 'Adopting' to 'Adoption' and scope notes added in version 2.02. Term name changed from 'Adoption' to 'Social services - adoptive homes' in version 3.00. Name changed to 'Adoption' in version 4.00.,Service,
225,Adult carers,"Provision of advice and support for adult carers who care for the elderly, children with special needs and adults with physical or learning disabilities. Carers may be entitled to receive additional help and support for their own needs from the local authority.",2013-04-03,2013-04-03,Added scope notes in version 2.02. Term name changed from 'Adult carers' to 'Carers - adult' in version 3.00. Name changed to 'Adult carers' in version 4.00.,Service,
27,Adult education courses,A broad range of adult education courses leading to nationally recognised qualifications to citizens. Citizens may be eligible for help towards the cost of the courses.,2013-04-03,2013-04-03,Term name changed from 'Courses' to 'Adult education courses' and scope notes added in version 2.02. Term name changed from 'Adult education courses' to 'Education - adult - courses' in version 3.00. Term name changed to 'Adult education courses' in version 4.00,Service,
293,Adult hospice care,Provision of information about hospices in the area for terminally ill people and their carers.,2013-04-03,2013-04-03,Term name changed from 'Hospice care' to 'Hospice care (excludes children)' and scope notes added in version 2.02. Term name changed from 'Hospice care (excludes children)' to 'Social services - hospice care - adults' in version 3.00. Name changed to 'Adult hospice care' in version 4.00.,Service,
1121,Adult placement,The Adult Placement Scheme helps approved Adult Placement Carers (ordinary people from the local community) to share their home and time with someone in need. It is similar to fostering but for adults.,2013-04-03,2013-04-03,Name changed to 'Adult placement' in version 4.00.,Service,
292,Adult residential care,Residential or nursing home for elderly people and people with disabilities who are unable to manage at home.,2013-04-03,2013-04-03,Added scope notes in version 2.02. Term name changed from 'Residential care' to 'Social services - residential care - adult' in version 3.00. Name changed to 'Adult residential care' in version 4.00.,Service,
1082,Advertisement control,Planning permission is required for certain types of advertisements and advertisements in specified areas. Copies of a Direction made under the relevant legislation must be kept open to inspection.,2013-04-03,2013-04-03,Name changed to 'Advertisement control' in version 4.00.,Service,
700,Advice for young people,"Integrated advice, guidance and access to personal development opportunities for young people aged between 13 and 19 to help them make a smooth transition to adulthood and working life",2013-04-03,2013-04-03,Added scope notes in version 2.02. Scope notes changed in version 3.00 for clarity. Term name changed from 'Advice for young people' to 'Children and young people - advice' in version 3.00. Name changed to 'Advice for young people' in version 4.00.,Service,
162,Advocacy for carers,"Provision of advice, counselling and support for those who are caring for adults or children with special needs.  Advocacy on behalf of carers may include raising awareness of carers issues and helping to keep them on the agenda of all relevant agencies, setting out key values and principles for services to carers in the form of a local Carers Charter and improving the quality and increasing the availability of information to carers.",2013-04-03,2013-04-03,Added scope notes in version 2.02. Term name changed from 'Advocacy for carers' to 'Carers - advocacy' in version 3.00. Name changed to 'Advocacy for carers in version 4.00.,Service,
728,Advocacy for social care clients,"Providing access to someone who can advocate on behalf of a social services client to ensure that they receive equal rights by writing letters, making phone calls, liaising with relevant agencies etc. on the clients behalf.",2013-04-03,2013-04-03,Added scope notes in version 2.02. Updated scope notes to clarify service provision in version 3.00. Term name changed from 'Advocacy for social services clients' to 'Social services - advocacy for clients' in version 3.00. Name changed to 'Advocacy for social care clients' in version 4.00.,Service,
1123,Affordable housing,Housing provided at below market prices and allocated on the basis of need to people who live or work in the area or need to move to the local area to receive/provide support and who are unable to afford to purchase or rent houses generally available on the open market without financial assistance..,2013-04-03,2013-04-03,Name changed to 'Affordable housing' and scope notes revised in version 4.00.,Service,
411,Air handling units,Ventilation and air-conditioning systems which are poorly installed or maintained may be a health risk to the public.  The local authority can provide advice and guidance on all aspects of installation and can require that detailed plans are submitted for inspection prior to installation of new units.  This particularly applies to catering establishments.,2013-04-03,2013-04-03,Added scope notes in version 2.02. Name changed to 'Air handling units' in version 4.00.,Service,
413,Air quality,"Each council has responsibility for measuring the quality of ambient air to ensure that it meets required standards in relation to the concentration of a defined range of pollutants such as lead, nitrogen dioxide, benzene etc. The local authority is also required to keep a copy of any orders made under relevant legislation.",2013-04-03,2013-04-03,Added scope notes in version 2.02. Scope notes updated in version 3.00 to include maintaining the statutory register. Term name changed from 'Pollution control - air' to 'Pollution control - air quality' in version 3.00. Name changed to 'Air pollution' in version 4.00.,Service,
727,Alcohol advice and support,This service provides counselling advice and support for people affected by alcohol abuse/dependency.,2013-04-03,2013-04-03,Added scope notes in version 2.02. Term name changed from 'Alcohol advisory service' to 'Social services - alcohol - advice and support' in version 3.00. Name changed to 'Alcohol advice and support' in version 4.00.,Service,
657,Alley gating,This service provides installation of security gates across footpaths and alleyways in residential areas and housing estates in order to combat crime.,2013-04-03,2013-04-03,Added scope notes in version 2.02. Term name changed from 'Alley gating' to 'Community safety - lane gating' in version 3.00. Name changed to 'Alley gating' in version 4.00.,Service,
86,Allocated council homes,The local authority will allocate vacant properties according to priority on the housing register and suitability for the available property. New tenants will be required to sign a tenancy agreement prior to occupation of a property.,2013-04-03,2013-04-03,Added scope notes in version 2.02. Term name changed from 'Housing allocations - allocated council home/lettings' to 'Housing - allocations - allocated council homes' in version 3.00. Name changed to 'Allocated council homes' in version 4.00.,Service,
510,Allotments,"Plots of land for use to grow vegetables, fruit and flowers available for rent by local citizens.  Water supplies, sheds/storage and skips are usually provided on allotment sites, car parking may also be available.  The authority will determine the regulations concerning the use of allotments and is responsible for ensuring adequate security (fences etc.) is provided.",2013-04-03,2013-04-03,Added scope notes in version 2.02. Term name changed from 'Conservation and urban design planning - allotments' to 'Planning - allotments' in version 3.00. Name changed to 'Allotments' in version 4.00.,Service,
732,Alternative care providers,"Independent agencies who provide care for adults and children within the local area.  Care agencies may provide any from the range of care services such as residential care, care at home, sheltered housing and day care.  The council may use these agencies to provide care services.",2013-04-03,2013-04-03,Added scope notes in version 2.02. Term name changed from 'Alternative providers of care' to 'Care - alternative providers' in version 3.00. Name changed to 'Alternative care providers' in version 4.00.,Service,
772,Animal importation,In order to ensure that animal diseases are not imported controls are in place which rely primarily on imported animals being accompanied by health certification and being subject to post-import veterinary inspection. Implementation of import regulations is the responsibility of the port authority into which the animals are imported.,2013-04-03,2013-04-03,Added scope notes in version 2.02. Scope notes revised in version 3.00 to clarify service responsibility. Term name changed from 'Importation of animals' to 'Ports of entry - animals - importation' in version 3.00. Name changed to 'Animal importation' in version 4.00.,Service,
788,Animal inspection,Enforcement of all animal health and welfare legislation designed to protect both domesticated and wild animals.,2013-04-03,2013-04-03,Added scope notes in version 2.02. Term name changed from 'Animal health and welfare' to 'Animals - inspection ' in version 3.00. Name changed to 'Animal inspection' in version 4.00.,Service,
434,Animal welfare,"The Animal welfare sections responds to both reports from the public, and undertakes proactive patrols. The aims of the service are to reduce the risk to human health from domesticated animals and/or the premises where they are kept, to prevent nuisance from pet animals or from the keeping or boarding of pet animals and to reduce the risk to animal health arising from commercial keeping of pet or similar non-livestock animals.",2013-04-03,2013-04-03,Added scope notes in version 2.02. Term name changed from 'Animal welfare' to 'Animals - welfare services' in version 3.00. Name changed to 'Animal welfare' in version 4.00.,Service,
1483,Anti-social behaviour  - solvent abuse,Police and partner agencies deal with reported incidents of noise and rowdy behaviour in public places resulting from solvent abuse,2013-04-03,2013-04-03,Added in version 3.11.,Service,
1480,Anti-social behaviour - begging and vagrancy,Police and partner agencies deal with reported incidents of begging and vagancy in the local area,2013-04-03,2013-04-03,Added in version 3.11.,Service,
1481,Anti-social behaviour - hoax or false calls to emergency services,Police and partner agencies deal with hoax calls made to emergency services.,2013-04-03,2013-04-03,Added in version 3.11.,Service,
1484,Anti-social behaviour - inconsiderate or nuisance,Police and partner agencies deal with reported incidents of noise and rowdy behaviour in public places which is causing a nuisance to other members of the public,2013-04-03,2013-04-03,Added in version 3.11.,Service,
1485,Anti-social behaviour - neighbour nuisance,Police and partner agencies deal with incidents of noise and rowdy behaviour in private property which is causing a nuisance to neighbours,2013-04-03,2013-04-03,Added in version 3.11.,Service,
1486,Anti-social behaviour - street drinking,Police and partner agencies deal with incidents of noise and rowdy behaviour as a result of street drinking,2013-04-03,2013-04-03,Added in version 3.11.,Service,
1487,Anti-social behaviour - vehicle,Police and partner agencies deal with incidents of noise and rowdy behaviour involving vehicles,2013-04-03,2013-04-03,Added in version 3.11.,Service,
1482,Anti-social behaviour -malicious or nuisance communication,Police and partner agencies deal with reported incidents malicious or nuisance communication to members of the public,2013-04-03,2013-04-03,Added in version 3.11.,Service,
369,Approved suppliers,An approved list of suppliers and or contractors is maintained and is amended as required from time to time by the local authority. Local businesses may apply to be placed on the list of approved suppliers for work to be carried out for or on behalf of the council,2013-04-03,2013-04-03,Added scope notes in version 2.02. Term name changed from 'Approved suppliers' to 'Council - approved suppliers' in version 3.00. Name changed to 'Approved suppliers' in version 4.00.,Service,
618,Archaeology - consultancy,"Provision of archaeological services and consultancy to both commercial and public sector clients in the local area.  May offer talks, exhibitions to the public and to local schools.",2013-04-03,2013-04-03,Added scope notes in version 2.02. Term name changed from 'Archaeological consultancy' to 'Archaeology - consultancy' in version 3.00.,Service,
619,Archaeology - excavations and surveys,Protection and conservation of historic sites which includes advising on planning proposals for new developments where the development may impact on archaeological sites and monuments.,2013-04-03,2013-04-03,Added scope notes in version 2.02. Term name changed from 'Archaeological excavations and surveys' to 'Archaeology - excavations and surveys' in version 3.00.,Service,
604,"Archive loans, donations, bequests and sales","Information of local interest which is available for viewing by the community are often donated, bequeathed or loaned to the records office by local residents and historians.  The local authority should have a standard agreement which is used to details terms of the loan or donation.",2013-04-03,2013-04-03,"Added scope notes in version 2.02. Term name changed from 'Loans, donations, bequests and sale to the Records Office' to 'Archives - loans, donations bequests and sales' in version 3.00. Name changed to 'Archive loans, donations, bequests and sales' in version 4.00.",Service,
605,Archive withdrawals,"A depositor may permanently withdraw their records at any time, provided notice is given to the Record Office. During this period of notice, the local authority reserves the right to copy the records and to make these copies available for private research",2013-04-03,2013-04-03,Added scope notes in version 2.02. Term name changed from 'Withdrawal of records' to 'Archives - withdrawals' in version 3.00. name changed to 'Archive withdrawals' in version 4.00.,Service,
448,Archives,"Archives are original documents produced by official bodies, societies and individuals that are no longer in current use. The council may provide a way for local residents and business to view their archives, often in a local library.",2013-04-03,2013-04-03,Added scope notes in version 2.02. Term name changed from 'Archives' to 'Archives - general information' in version 3.00. Name changed to 'Archives' in version 4.00.,Service,
877,Area waste strategy,"The Aim of an Area Waste Plan (AWP) is to contribute to the sustainable development of the area by developing waste management systems that will control waste generation, reduce its environmental impact, improve resource efficiency, stimulate investment and maximise the economic opportunities arising from waste. The AWP covers all types of waste (household, commercial, industrial) but initially focuses on municipal waste (MW).",2013-04-03,2013-04-03,Scope notes revised in version 3.00 to clarify council responsibility. Term name changed from 'Municipal waste strategy' to 'Refuse - area waste strategy' in version 3.00. Name changed to 'Area waste strategy' in version 4.00.,Service,
1603,Arson investigation,Investigation of the cause of fires where arson is suspected.,2013-04-03,2013-04-03,Added in version 4.00.,Service,
800,Arson reduction,Advice on measures which can be taken by businesses and residents to reduce the likelihood of arson on their premises.,2013-04-03,2013-04-03,Added scope notes in version 2.02. Term name changed from 'Arson reduction' to 'Fire and rescue - arson reduction' in version 3.00. Name changed to 'Arson reduction' in version 4.00.,Service,
1372,Art commissions,A local administration may commission works of art from local or other artists for display in public buildings or other art exhibitions in the area.,2013-04-03,2013-04-03,Added in version 3.09. Name changed to 'Art commissions' and scope notes updated in version 4.00.,Service,
884,Arts development,"Support and development of arts in the local community.  This is typically achieved by  by giving residents the opportunity to take part in arts activities and  also by providing information and support to local artists, arts groups and members of the public. The local authority may run arts projects in the community and work with local artists and other groups to plan future arts activity.",2013-04-03,2013-04-03,Term name changed from 'Arts development' to 'Arts - development' in version 3.00. Name changed to 'Arts development' and scope notes revised in version 4.00.,Service,
838,Arts organisations and events,"Provision of information and advice on local arts organisations, exhibitions and events.",2013-04-03,2013-04-03,"Added scope notes in version 2.02. Term name changed from 'General arts information (inc. location, events)' to 'Arts - information' in version 3.00. Name changed to 'Arts organisations and events' in version 4.00.",Service,
415,Asbestos management,Residents and business may be given advice on what to do if they believe asbestos may be present in a building.  Council inspectors may visit the premises to confirm the presence of asbestos and advise on procedures for removal and disposal.,2013-04-03,2013-04-03,Added scope notes in version 2.02. Name changed to 'Asbestos management' in version 4.00. ,Service,
147,Assisted garden maintenance,Garden maintenance for elderly (aged 60 or over) or disabled tenants who are not capable of doing the work themselves.,2013-04-03,2013-04-03,Added scope notes in version 2.02. Term name changed from 'Garden maintenance' to 'Social services - garden maintenance' in version 3.00. Name changed to 'Assisted garden maintenance' in version 4.00.,Service,
915,Asylum seekers - nationality checking,Checking of applications for citizenship prior to submission of the application to the relevant authority.,2013-04-03,2013-04-03,Term name changed from 'Nationality checking' to 'Asylum seekers - nationality checking' in version 3.00.,Service,
77,Asylum seekers support,"Provision of temporary accommodation, meals and other advice and support for asylum seekers i.e. those waiting for an application for refugee status to be assessed by the government.",2013-04-03,2013-04-03,Added scope notes in version 2.02. Term name changed from 'Asylum seekers support' to 'Asylum seekers - advice and support' in version 3.00. Name changwed to 'Asylum seekers support' in version 4.00.,Service,
1474,Attending arson incidents,Fire and rescue services will attend and deal with reported incidents of arson or suspected arson.,2013-04-03,2013-04-03,Added in version 3.11. Name changed to 'Attending arson incidents' in version 4.00.,Service,
801,Attending automatic fire alarms,The local fire authority can provide advice to residents and business on the installation of automatic fire alarms and on the testing of such alarm systems following installation or any building/redecoration work undertaken in the alarmed area.,2013-04-03,2013-04-03,Added scope notes in version 2.02. Term name changed from 'Automatic fire alarms' to 'Fire and rescue - attending automatic alarms' in version 3.00. Name changed to 'Attending automatic fire alarms' in version 4.00.,Service,
815,Attending fires,The fire services directs emergency calls to the emergency call handling centre which routes all calls for an area to fire control. Control will confirm with the address of the incident and help will be despatched immediately.,2013-04-03,2013-04-03,Added scope notes in version 2.02. Term name changed from 'Attending fires' to 'Fire and rescue - attending fires' in version 3.00. Name changed to 'Attending fires' in version 4.00.,Service,
379,Auction premises licence,"Any premises used for public auctions must be registered unless the auction is a one day charity event. In this case, proof of charity status will be required. There is an application fee which must be paid at the time the application is made.",2013-04-03,2013-04-03,Added scope notes in version 2.02. Scope notes changed to clarify scope in version 3.00. Term name changed from 'Licence - auction premises' to 'Licences - auction premises' in version 3.00. Name changed to 'Auction premises licence' in version 4.00.,Service,
756,Beach patrols,This service generally operates during the hours of popular use of a beach. Its purpose is primarily to ensure the safety of beach users and to prevent anti-social behaviour which disturbs other beach users.,2013-04-03,2013-04-03,Added scope notes in version 2.02. Term name changed from 'Beach patrol' to 'Coastline - beach patrols' in version 3.00. name changed to 'Beach patrols' in version 4.00.,Service,
896,Behaviour development,"Educational psychologists work closely with teachers and parents to help children who are having difficulties with: Learning and general development, including reading, writing, spelling and numbers; Emotions and behaviour; Making good relationships with other children and with adults.",2013-04-03,2013-04-03,Term name changed from 'Education development behaviour centres' to 'Education - behaviour development ' in version 3.00. Name changed to 'Behaviour development' in version 4.00.,Service,
726,Benefit fraud,"The local authority aim to detect and prevent any fraudulent benefit claims, stopping and reducing payment in fraudulent cases and preventing over-payment claims.",2013-04-03,2013-04-03,Added scope notes in version 2.02. Term name changed from 'Fraud investigation' to 'Benefits - fraud investigation' in version 3.00. Name changed to 'Benefit fraud' in version 4.00.,Service,
