Identifier,Label,Description,Created,Modified,History notes,Type,
749,Countryside rangers,The countryside ranger service manages the countryside sites. The rangers carry out practical conservation work and environmental education in addition to organising events and activities.,2013-04-03,2013-04-03,Added scope notes in version 2.02. Term name changed from 'Ranger services' to 'Countryside - ranger services' in version 3.00. Name changed to 'Countryside rangers' in version 4.00.,Service,
470,Countryside surveys,The local authority in conjunction with partner organisations (wildlife trusts etc.) or volunteer groups may carry out surveys of the local countryside in order to determine the diversity and density of flora and fauna within the local environment.,2013-04-03,2013-04-03,Term name changed from 'Surveys' to 'Countryside surveys' and scope notes added in version 2.02. Term name changed from 'Countryside surveys' to 'Countryside - surveys' in version 3.00. Name changed to 'Countryside surveys' in version 4.00.,Service,
469,Countryside visitor centres,"Countryside visitor centres may provide facilities for the public to learn about the local area by means of exhibitions, talks and guided walks etc.  Visitor centres may also provide refreshments and toilet facilities.",2013-04-03,2013-04-03,Term name changed from 'Visitor centres' to 'Countryside visitor centres' and scope notes added in version 2.02. Term name changed from 'Countryside visitor centres' to 'Countryside - visitor centres' in version 3.00. Name changed to 'Countryside visitor centres' in version 4.00.,Service,
750,Countryside volunteers,"Volunteers may help to look after the local countryside in a varierty of ways.  These can include practical work such as repairing footpaths, helping at events, helping visitors to enjoy the area and carrying out visitor surveys.",2013-04-03,2013-04-03,Added scope notes in version 2.02. Term name changed from 'Countryside volunteers' to 'Countryside - volunteers' in version 3.00. Name changed to 'Countryside volunteers' and scope notes updated in version 4.00.,Service,
759,Cranage,Port and harbour authorities where cargo is handled provide mobile cranes for the loading/unloading of cargo.  They also provide equipment for handling of cargo once unloaded such as fork lift trucks etc.,2013-04-03,2013-04-03,Added scope notes in version 2.02. Term name changed from 'Cranage' to 'Ports and harbours - cranage' in version 3.00. name changed to 'Cranage' in version 4.00.,Service,
352,Credit unions,"A credit union is a profit sharing, democratically run financial co-operative which offers convenient savings and low interest loans to its members.  The local authority may offer support to local credit unions by providing advice and information to help them get started and manage their affairs in a legal and efficient way.",2013-04-03,2013-04-03,Added scope notes in version 2.02. Term name changed from 'Credit unions' to 'Banking - credit unions' in version 3.00. Name changed to 'Credit unions' in version 4.00.,Service,
1476,Criminal damage - dwelling,"Police and partner agencies, including the local council, deal with reported incidents of criminal damage to residential property in the local area.",2013-04-03,2013-04-03,Added in version 3.11.,Service,
1477,Criminal damage - non-domestic building,"Police and partner agencies, including the local council, deal with reported incidents of criminal damage to business and other non-residential property in the local area.",2013-04-03,2013-04-03,Added in version 3.11.,Service,
1479,Criminal damage - non-specific,"Police and partner agencies, including the local council, deal with reported incidents of general criminal damage in the local area.",2013-04-03,2013-04-03,Added in version 3.11.,Service,
1478,Criminal damage - property,"Police and partner agencies, including the local council, deal with reported incidents of criminal damage to personal and public property (other than buildings) in the local area.",2013-04-03,2013-04-03,Added in version 3.11.,Service,
1475,Criminal damage - vehicle,"Police and partner agencies, including the local council, deal with reported incidents of criminal damage to vehicles in the local area.",2013-04-03,2013-04-03,Added in version 3.11.,Service,
1159,Cultural grants,"Cultural grants provide financial assistance for new arts activities, events or projects, which will have a positive impact on cultural life in the local area.",2013-04-03,2013-04-03,Added in version 3.06. Name changed to 'Cultural grants' in version 4.00.,Service,
1308,Current emergency situations - civil,"Publication of information and advice on how to deal with civil emergency weather situations such as rioting, threats of terrorism etc.",2013-04-03,2013-04-03,Added in version 3.09,Service,
1287,Current emergency situations - health,Provision of information to the public on what to do/who to contact in the event of an ongoing emergency related to public health such as a flu outbreak.,2013-04-03,2013-04-03,Added in version 3.07. Name and scope notes updated in version 3.09.,Service,
1307,Current emergency situations - weather,"Publication of information and advice on how to deal with emergency weather conditions such as flooding, heavy snowfalls etc.",2013-04-03,2013-04-03,Added in version 3.09,Service,
337,Current vacancies,Publication of current job vacancies within a local authority.,2013-04-03,2013-04-03,Term name changed from 'Vacancies' to 'Job vacancies' and scope notes added in version 2.02. Term name changed from 'Job vacancies' to 'Jobs - local authority vacancies' in version 3.00. Name changed to 'Current vacancies' in version 4.00.,Service,
653,Customer satisfaction surveys,Asking customers for feedback on performance in relation to services or other aspects of business provided by local public sector organisations..,2013-04-03,2013-04-03,Added scope notes in version 2.02. Term name changed from 'Customer satisfaction surveys' to 'Council - performance - customer satisfaction surveys' in version 3.00.,Service,
1530,Cycle hire,The municipal authority hires out bicycles and/or makes bicycles available for free.,2010-10-20,2010-10-20,Added scope notes in version 3.11.,Service,
539,Cycle lanes and routes,"Provision for cycle routes on the carriageway, on footways either shared with or segregated from pedestrians, or specially designated cycle paths.",2013-04-03,2013-04-03,Added scope notes in version 2.02. Term name changed from 'Road markings and signage - cycle lanes and routes' to 'Roads - markings and signage - cycle lanes and routes' in version 3.00. Name changed to 'Cycle lanes and routes' in version 4.00.,Service,
547,Cycle training,"Provision of training for those who are new to cycling. Many local authorities run cycle training schemes for children in local schools; some may also provide training for adults, either directly or working with independent instructors.
Cycle training is co-ordinated in England by Cycling England, a partnership body set up by several government departments. It adminsters 'Bikeability', the National Standard for Cycle Training, and provides resources to support training initiatives. . In Scotland a similar scheme is operated by Cycling Scotland.",2013-04-03,2013-04-03,"Added scope notes in version 2.02, updated in version 3.06. Term name changed from 'Roads - safety - cycling proficiency' to 'Roads - safety - cycle training' in version 3.06. Name changed to 'Cycle training' in version 4.00.",Service,
546,Cycling and walking to school schemes,"Promotion of safer, more environmentally sustainable and healthier ways of getting to and from school with particular emphasis on walking and cycling.",2013-04-03,2013-04-03,Added scope notes in version 2.02. Term name changed from 'Road safety - cycling and walking to school' to 'Roads - safety - cycling and walking to school' in version 3.00. Name changed to 'Cycling and walking to school schemes' in version 4.00.,Service,
1566,Cycling schemes,"Schemes which promote the use of cycling as a method of transport within the local area.  Such schemes typically consider reduction in vehicle traffic, cycle routes, cyclist safety, cycle parking facilities.  In some cases schemes may also include a discount or tax reduction on the purchase of a bicycle. ",2010-10-20,2010-10-20,Added scope notes in version 3.11.,Service,
376,Dangerous animals licence,"""In order to keep any animal classed as a 'dangerous wild animal' a licence is required. The local authority issues licences and, in addition to powers of inspection, can also seize any animal being kept on premises which are unlicensed. Zoos, pet shops and circuses are not included under this Licence as these premises are subject to separate licensing requirements.
In th UK a schedule included with the relevant legislation contains a list of the various animals classed as 'dangerous wild animals""@en",2013-04-03,2013-04-03,"Added scope notes in version 2.02. Scope notes updated in version 3.00 to cover the full scope of the service. Term name changed from 'Licence - exotic, dangerous or wild animals' to 'Licences - dangerous animals' in version 3.00. Name changed to 'Dangerous animal licence' in version 4.00.",Service,
1471,Dangerous dogs enforcement,The police will deal with incidents where a dog is posing a risk to members of the public.,2013-04-03,2013-04-03,Added in version 3.11. Name changed to 'Dangerous dogs enforcement' in version 4.00.,Service,
545,Dangerous road improvements,"The Council should have a continuing programme of schemes to improve the safety and operation of the highway network. Many of these schemes originate from requests made by the public.  As well as concerns about the safety of individual road junctions, there are requests for pedestrian crossing facilities, speed restraint measures (such as road humps), and minor issues such as new warning signs.",2013-04-03,2013-04-03,Added scope notes in version 2.02. Term name changed from 'Road safety - dangerous road junctions' to 'Roads - safety - dangerous road junctions' in version 3.00. Name changed to 'Dangerous road improvements' in version 4.00.,Service,
600,Dangerous structures,"The local authority has a responsibility to deal with buildings which have become dangerous due to old age, deterioration or settlement, or by more dramatic causes.  This includes procurement of construction work and consultants.",2013-04-03,2013-04-03,Added scope notes in version 2.02. Term name changed from 'Dangerous structures and public safety' to 'Land and property - dangerous structures - public safety' in version 3.00. Scope notes amended in version 3.05. Name changed to 'Dangerous structures' in version 4.00.,Service,
826,Data Protection,"Regulations to cover the collecting, storing, processing and distribution of personal data. It gives rights to individuals about whom information is recorded. The local authority is responsible for ensuring that they comply with the terms of relevant legislation.",2013-04-03,2013-04-03,Added scope notes in version 2.02. Term name changed from 'Data Protection Act' to 'Data Protection' in version 3.00.,Service,
576,Dead animal removal,The local authority will arrange removal of dead animals from all publicly accessible areas.,2013-04-03,2013-04-03,Added scope notes in version 2.02. Term name changed from 'Animals - dead' to 'Animals - dead - removal' in version 3.00. Name changed to 'Dead animal removal' in version 4.00.,Service,
324,Death - historical searches,"Searches of the records in a Registrars Office for details of a previously registered death.  Copy certificates can only be obtained from the district in which the death was first registered.  The minimum information needed to find an entry is the name of the person, place and year of death.",2013-04-03,2013-04-03,Added scope notes in version 2.02. Term name changed from 'Deaths historical searches' to 'Death - historical searches' in version 3.00.,Service,
326,Death - repatriation of bodies - Scotland,"If a death occurs abroad, the death should be registered according to the local regulations of that country. 
To bring a body back to England or Wales either the Death Certificate or an authorisation for the removal of the body from the country of death is needed. The registrar in the district in which the funeral is to take place has to issue a 'Certificate of No Liability to Register'. 
You can bring a body back to Scotland once you have got the death certificate and an authorisation for the removal of the body from the country of death from the appropriate authorities. To bring the body into Scotland you will need either an autmenticated translation of a foreign death certificate or a death certificate issued in England, Wales or Northern Ireland, depending on the place of death.",2013-04-03,2013-04-03,Added scope notes in version 2.02. Scope notes changed in version 3.00 to include Scottish regulations. Term name changed from 'Repatriation of a deceased body from abroad to England or Wales' to 'Death - repatriation of bodies - England and Wales' in version 3.00. Name changed to 'Repatriation of bodies - England and Wales' in version 4.00.,Service,
321,Death registration,"Registration of a death.
In England and Wales a death should be registered in the district in which it takes place within five days of the date of death. Upon receipt of all required information pertaining to the deceased person a death certificate is issued by the registrar. 
In Scotland any death which occurs must be registered within 8 days by the Registrar of Births, Deaths and Marriages. A death may be registered in any Registration Office in Scotland provided the death was in Scotland.",2013-04-03,2013-04-03,Added scope notes in version 2.02. Scope notes amended in version 3.05. Name changed to 'Death registration' in version 4.00.,Service,
651,Debt counselling,"This service offers free confidential debt counselling service to citizens. They can advise on different types of debt such as rent and mortgage arrears, credit card debts and bank loans.",2013-04-03,2013-04-03,Added scope notes in version 2.02. Term name changed from 'Debt counselling' to 'Social services - debt counselling' in version 3.00. Name changed to 'Debt counselling' in version 4.00.,Service,
1520,Debt enforcement,"Where money is owed to a local administration they have the right to pursue repayment of the debt.  Such activities are usually carried out under the authority of an enforcement officer who may, if all other options have failed, seize assets of the debtor to cover the debt.",2010-10-14,2010-10-14,Added scope notes in version 3.11.,Service,
143,Decoration and disturbance allowances,A new or existing tenant may be eligible for a decoration or disturbance allowance where the council need to carry out major repairs or redecoration work to a property whilst the tenant is still living there.,2013-04-03,2013-04-03,Added scope notes in version 2.02. Term name changed from 'Housing repairs - decoration and disturbance allowances' to 'Housing - repairs - decoration and disturbance allowances' in version 3.00. Name changed to 'Decoration and disturbance allowance' in verison 4.00.,Service,
901,Demand responsive transport,Provision of on demand transport services for local citizens usually available in areas not covered by main public transport routes.,2013-04-03,2013-04-03,Term name changed from 'Demand responsive transport (DRT)' to 'Transport - demand responsive transport ' in version 3.00. Name changed to 'Demand responsive transport' in version 4.00.,Service,
602,Demolition control,"Local authorities control demolition in the interests of safety and to ensure that any disturbance and/or inconvenience to the public and occupiers/owners of adjacent properties is kept to a minimum.  Anyone wishing to demolish a building or part of a building,is required to notify the local authority which will then normally issue a demolition notice specifying steps to be taken during the demolition works to ensure public safety.",2013-04-03,2013-04-03,Added scope notes in version 2.02. Term name changed from 'Demolitions - control and advice' to 'Land and property - demolitions - control and advice' in version 3.00. Name changed to 'Demolition control' and scope notes revised in version 4.00.,Service,
603,Demolition enforcement,"The council deal with incidents of nuisance being caused as a result of demolition work.  This includes noise, smoke and obstruction/damage to pavements and verges.",2013-04-03,2013-04-03,Term name changed from 'Demolitions - enforcements' to 'Demolitions - enforcement' and scope notes added in version 2.02. Term name changed from 'Demolitions - enforcement' to 'Land and property - demolitions - enforcement' in version 3.00. Name changed to 'Demolition enforcement' in version 4.00.,Service,
125,Demolitions - alternative housing,Where the demolition of nearby property may pose a risk to tenants in council property the authority may offer the tenant alternative housing either temporarily or on a permanent basis.,2013-04-03,2013-04-03,Added scope notes in version 2.02. Term name changed from 'Property demolition - services for council tenants affected by - alternative housing' to 'Land and property - demolitions - alternative housing for council tenants' in version 3.00. Name changed to 'Demolitions - alternative housing' in version 4.00.,Service,
126,Demolitions - disturbance allowance,Where the demolition of nearby property causes disturbance to tenants in council property the authority may pay a disturbance allowance in compensation for the disruption while the demolition work is taking place.,2013-04-03,2013-04-03,Added scope notes in version 2.02. Term name changed from 'Property demolition - services for council tenants affected by - disturbance allowance' to 'Land and property - demolitions - disturbance allowance for council tenants' in version 3.00. Name changed to 'Demolitions - disturbance allowance' in version 4.00.,Service,
128,Demolitions - property assessment,The local authority will continually review and assess housing conditions in the area to help determine which properties are unfit for occupancy or are abandoned.,2013-04-03,2013-04-03,Added scope notes in version 2.02. Term name changed from 'Property demolition - regeneration service - properties affected' to 'Land and property - demolitions - assessment' in version 3.00. Name changed to 'Demolitions - property assessment' in version 4.00.,Service,
127,Demolitions - tenants' responsibilities,The tenant is responsible for arranging for meter reading and disconnecting of supplies of gas/electricity and for handing in the keys of vacated property.  The council provide advice and support in these circumstances.,2013-04-03,2013-04-03,Added scope notes in version 2.02. Term name changed from 'Property demolition - services for council tenants affected by - tenants responsibilities' to 'Land and property - demolitions - council tenants' responsibilities' in version 3.00. Name changed to 'Demolitions - tenants' responsibilities' in version 4.00.,Service,
607,Demonstrations and parades permission,Permission from local authorities will be needed for the closure of roads to allow sporting events or parades to take place.,2013-04-03,2013-04-03,Added scope notes in version 2.02. Term name changed from 'Demonstrations and parades' to 'Demonstrations and parades - granting of permission' in version 3.00. name changed to 'Demonstrations and parades permission' in version 4.00.,Service,
684,Derelict properties,Ensuring that long-term empty properties are secure and do not pose any risk to the public.  In some circumstances the council may compulsorily purchase such properties for renovation or demolition.,2013-04-03,2013-04-03,Added scope notes in version 2.02. Scope notes extended in version 3.00 to include security aspect. Term name changed from 'Open and derelict properties' to 'Land and property - derelict properties - public safety' in version 3.00. Name changed to 'Derelict properties' in version 4.00.,Service,
608,Development control,"Development Control is responsible for the determination and monitoring of planning applications, and other associated applications (listed building consent, advertisement consent etc) submitted to the Council under planning legislation.",2013-04-03,2013-04-03,Added scope notes in version 2.02. Term name changed from 'Development control' to 'Planning - development control' in version 3.00. Name changed to 'development control' in version 4.00.,Service,
1158,Development control enforcement,As part of development control enforcement the Council deals with breaches of planning control and investigates complaints about unauthorised development.,2013-04-03,2013-04-03,Added in version 3.06. Name changed to 'Development control enforcement' in version 4.00.,Service,
287,Direct payments,A direct payment is a cash payment allowing clients to buy their own support instead of Social Services providing it. The money can be used to employ a personal assistant or to use an agency to provide staff for you. A client can 'mix and match' and have some support provided by Social Services and take some as a direct payment. Recent 'Self-directed care' schemes have involved managing adult social care in general on the basis of the individual choosing their care package based on a fixed budget.,2013-04-03,2013-04-03,"Added scope notes in version 2.02, updated in version 3.06. Term name changed from 'Direct payments' to 'Social services - direct payments' in version 3.00. Name changed to 'Direct payments' in version 4.00.",Service,
221,Disabled and older people - rail card,"A rail card (or other travel concession) is available to local citizens if they are aged 60 and over, they are physically disabled or they have a learning difficulty.  Eligibility for a rail card or a combined travel concession card will need to be assessed.  Depending on the degree of need the rail card may offer either free travel or travel at a reduced rate.",2013-04-03,2013-04-03,Added scope notes in version 2.02. Term name changed from 'Rail card' to 'Disabled and older people - rail card' in version 3.00.,Service,
137,Disabled facilities grant,The disabled facilities grant scheme provides financial assistance towards the cost of essential adaptation work to make a house fit for a disabled person.,2013-04-03,2013-04-03,Added scope notes in version 2.02. Term name changed from 'Home improvements - disability facility grant for a private property' to 'Housing - improvements - disability facility grant for a private property' in version 3.00. Name changed to 'Disabled facilities grant' in version 4.00.,Service,
280,Disabled people - bus passes,"A bus pass (or other travel concession) is available to local citizens if they are aged 60 and over, they are physically disabled, they have a learning difficulty or they would be refused a driving licence. Eligibility is automatic if the applicant is already in receipt of other services as a result of their age/disability.",2013-04-03,2013-04-03,Added scope notes in version 2.02. Term name changed from 'Disabled bus pass' to 'Disabled people - bus passes' in version 3.00.,Service,
299,Disabled people - employment advice,Advice and support for those with special needs who may wish to seek full-time or part time employment. This may include advice to employers on the requirements of relevant legislation.,2013-04-03,2013-04-03,Added scope notes in version 2.02. Term name changed from 'Employment advice' to 'Jobs - employment - advice' in version 3.00. Name changed to 'Disabled people - employment advice' in version 4.00.,Service,
239,Disabled people - employment and training schemes,"Advice and support on training and employment available to people with physical, sensory or other disabilities.  This includes advice on legal issues surrounding employment.  The advice may be provided by the local authority or through third party organisations and includes schemes such as 'Supported Employment Schemes'.",2013-04-03,2013-04-03,Term name changed from 'Employment/training' to 'Employment and training' and scope notes added in version 2.02. Name changed and scope notes updated in version 3.00 to clarify the inclusion of local employment schemes. Term name changed from 'Employment and training' to 'Disabled people - employment and training schemes' in version 3.00.,Service,
178,Disabled people - home adaptations and aids,"If a client is visually impaired, hard of hearing or has other disabilities for which he/she may need special equipment or adaptations to his/her home the local authority will provide such equipment which will assist in overcoming difficulties subject to an assessment of personal needs to determine eligibility.",2013-04-03,2013-04-03,Added scope notes in version 2.02. Term name changed from 'Equipment and adaptations to the home' to 'Disabled people - home adaptations and aids' in version 3.00.,Service,
204,Disabled people - independence at home,"Rehabilitation provides people with physical and sensory disabilities with help to recover and regain their independence often following an illness or injury/stay in hospital.  A care worker will provide advice on how to cope with illness or disability, or organise the provision of aids and equipment to help in everyday tasks.",2013-04-03,2013-04-03,Added scope notes in version 2.02. Term name changed from 'Rehabilitation' to 'Disabled people - independence at home' in version 3.00.,Service,
